"Nome","Ato de Criação","Data de Criação","Link","ResumoBreve"
"Refúgio de Vida Silvestre Tabuleiro do Embaubal (REVIS)","Decreto Estadual nº 1.566",17/06/16,"https://ideflorbio.pa.gov.br/refugio-de-vida-silvestre-tabuleiro-do-embaubal/","Refúgio de Vida Silvestre Tabuleiro do Embaubal (REVIS Tabuleiro do Embaubal): Unidade de Conservação Estadual de Proteção Integral criada em 2016 (Decreto Estadual nº 1.566 de 17 de junho de 2016), situada no município de Senador José Porfírio, no Pará, com uma área aproximada de 4.033,94 hectares. Seu objetivo principal é preservar os ecossistemas naturais e garantir a proteção da fauna e flora nativas, mantendo a integridade dos processos ecológicos da região. É especialmente conhecida como a maior área de desova da tartaruga-da-Amazônia (Podocnemis expansa), além de ser um ponto de desova para o Pitiú (Podocnemis sextuberculata) e o Tracajá (Podocnemis unifilis). A unidade também abriga diversas espécies aquáticas como o boto-vermelho e o peixe-boi amazônico, e é um importante ponto para aves migratórias. Sendo uma unidade de proteção integral, não permite o uso direto dos recursos naturais, focando em pesquisa científica, educação ambiental e visitação pública controlada."
"Reserva de Desenvolvimento Sustentável Vitória de Souzel","Decreto Estadual Nº 1.566",17/06/16,"https://ideflorbio.pa.gov.br/reserva-de-desenvolvimento-sustentavel-vitoria-de-souzel/","Reserva de Desenvolvimento Sustentável Vitória de Souzel (RDS Vitória do Souzel): Unidade de Conservação Estadual de Uso Sustentável criada em 2016 (Decreto Estadual nº 1.566, de 17 de junho de 2016). Localizada no município de Senador José Porfírio, na região do rio Xingu, abrange uma área de aproximadamente 22.957 hectares. Seu objetivo é proteger os recursos ambientais e socioculturais da região, promovendo o desenvolvimento sustentável das comunidades tradicionais que habitam o território. A unidade é caracterizada por rica biodiversidade, com florestas de terra firme, áreas alagáveis e cursos dágua. Desempenha um papel fundamental na conservação dos ecossistemas locais e na proteção de nascentes. A gestão busca conciliar a proteção ambiental com a promoção de alternativas sustentáveis de geração de renda, educação ambiental e fortalecimento dos saberes tradicionais. A RDS Vitória do Souzel representa um modelo de gestão integrada e participativa."
"Reserva de Desenvolvimento Sustentável Campo das Mangabas","Decreto Nº 1.567",17/06/16,"https://ideflorbio.pa.gov.br/reserva-de-desenvolvimento-sustentavel-campo-das-mangabas/","Reserva de Desenvolvimento Sustentável Campo das Mangabas (RDS Campo das Mangabas): Unidade de Conservação Estadual de Uso Sustentável, instituída em 2016 (Decreto Nº 1.567, de 17 de junho de 2016), localizada no município de Maracanã/PA. Protege uma região com características de Cerrado com predominância de espécies como a mangaba, o muruci e o bacuri. A coleta desses frutos é realizada pelas comunidades locais para consumo próprio ou venda, principalmente nos meses de safra (outubro/dezembro para mangaba, janeiro/março para bacuri). No mês de dezembro, ocorre a celebração denominada ""festa do Bacuri"". O processo de criação desta UC iniciou em 2007, por solicitação de associações locais para evitar ações predatórias e ocupação desordenada. Limita-se ao Norte, Leste e Oeste com a Reserva Extrativista de Maracanã (administração do ICMBio) e ao sul com parte da PA-430."
"Monumento Natural Atalaia (MONA)","Decreto Estadual nº 2.077",23/05/18,"https://ideflorbio.pa.gov.br/monumento-natural-atalaia-mona/","Monumento Natural Atalaia (MONA Atalaia): Unidade de Proteção Integral criada em 2018 (Decreto Estadual Nº 2.077, de maio de 2018), com uma área de 256,58 hectares. Está destinada ao desenvolvimento de estudos e pesquisas científicas, ecoturismo, recreação e lazer, educação ambiental e a conservação da natureza. O espaço não permite moradia nem exploração dos recursos naturais. O MONA Atalaia é formado pelo lago da Coca-Cola e lagos de recarga no entorno, dunas fixas e móveis, e vegetação de restingas, manguezais e pequenos igarapés. Seus objetivos incluem garantir a proteção das belezas cênicas, dunas, restingas, manguezais e lagos, a preservação de espécies da flora e fauna (residentes e migratórias), proteger amostras representativas de ecossistemas costeiros, ordenar o turismo e oportunizar a educação ambiental."
"Refúgio de Vida Silvestre Rios São Benedito e Azul  (REVIS)","Decreto Nº 1.944",21/10/21,"https://ideflorbio.pa.gov.br/refugio-de-vida-silvestre-rios-sao-benedito-e-azul-dgbio/","Refúgio de Vida Silvestre Rios São Benedito e Azul (REVIS Rios São Benedito e Azul): Unidade de Conservação de Proteção Integral, criada em 2021 (Decreto Nº 1.944, de 21 de outubro de 2021), com uma área de 30.032,00 hectares. Localiza-se nos municípios de Jacareacanga e Novo Progresso, na Região de Integração Tapajós. Seu objetivo é proteger ambientes naturais para a existência e reprodução de espécies da flora e fauna local ou migratória, além de atuar como uma barreira ecológica de aproximadamente 200 km de extensão no sentido Leste-Oeste, impedindo o avanço do desmatamento vindo do estado do Mato Grosso. Possui potencial para ecoturismo, passeios e pesca esportiva, estudos, pesquisas, interpretação e educação ambiental. A unidade abrange o bioma Amazônico em transição para o Cerrado, com ecossistemas de águas claras, lagoas, igapós, matas ciliares, cerrados e florestas ombrófilas."
"Estação Ecológica Mamuru (ESEC)","Decreto Nº 3.314",05/09/23,"https://ideflorbio.pa.gov.br/estacao-ecologica-mamuru-dgbio/","Estação Ecológica Mamuru (ESEC Mamuru): É a 28ª Unidade de Conservação da Natureza criada pelo Governo do Estado do Pará, localizada nos municípios de Aveiro e Juruti. Com uma área de 126 mil hectares, a ESEC Mamuru é uma Unidade de Conservação de Proteção Integral. Sua criação (Decreto de criação de nº 3.314, em 05 de setembro de 2023) foi precedida por rigorosos estudos técnicos e consulta pública. Desempenha um papel crucial na proteção da biodiversidade e dos ecossistemas do oeste do Pará, contribuindo para a preservação de espécies em risco e a manutenção de serviços ecológicos. Seus objetivos incluem a preservação da natureza, a realização de pesquisas científicas, a proteção de espécies ameaçadas, a educação ambiental e a proteção das nascentes e afluentes do rio Mamuru. A ESEC Mamuru se integra a um mosaico de áreas protegidas na região, incluindo terras indígenas e parques nacionais. Pode gerar renda para os municípios por meio de pagamento por serviços ambientais e ICMS Ecológico."
